comment_id,comment_text,comment_url,comment_time,comment_reaction_count,commenter_id,commenter_name,profile_url,commenter_url,reply_count
e0e90mc,IM JUST SO FUCKING HAPPY FOR YOU. OH MY GOD IM SO EXCITED YOU LOOK BEAUTIFUL 😍,/r/SkincareAddiction/comments/8pv3gg/ba_finished_my_5_month_course_of_accutane_just_in/e0e90mc/,1528571779.0,5302,t2_16n4n6ac,synnoreen,https://www.reddit.com/user/synnoreen,https://www.reddit.com/user/synnoreen,4
e0ekyfe,That accutane glow is so real. I miss it. You are positively stunning.,/r/SkincareAddiction/comments/8pv3gg/ba_finished_my_5_month_course_of_accutane_just_in/e0ekyfe/,1528584691.0,570,t2_xgpym,Mehmeh111111,https://www.reddit.com/user/Mehmeh111111,https://www.reddit.com/user/Mehmeh111111,1
e0ezpay,"omg yes i miss the glow my face had while i was on accutane so much!! 

i remember one time out to dinner my waitress gave us the check and she said to me, “i just have to say you have the nicest skin i have ever seen!” and it took everything in me to not cry because when you’ve had horrible skin your whole life it seems that’s the nicest compliment you could ever receive. 

wish my skin was that glowy still haha",/r/SkincareAddiction/comments/8pv3gg/ba_finished_my_5_month_course_of_accutane_just_in/e0ezpay/,1528602090.0,527,t2_12fqs5,cbax297,https://www.reddit.com/user/cbax297,https://www.reddit.com/user/cbax297,1
e0ptnab,I have the glow right now too!!! How are you post accutane? Has the acne come back? I still have 5 months to go!,/r/SkincareAddiction/comments/8pv3gg/ba_finished_my_5_month_course_of_accutane_just_in/e0ptnab/,1529071400.0,38,t2_hlw0s0m,quirkyfellows,https://www.reddit.com/user/quirkyfellows,https://www.reddit.com/user/quirkyfellows,1
e0py6tb,"the little cc’s on my forehead and jawline kinda came back and i’ll get an occasional pimple or two usually around the time of my period but it’s nothing like it used to be at all. the stridex pads have def helped with the cc’s keeping them almost gone, my period just ended this last week and i currently only have 2 pimples that are kinda incoming but that’s it! Accutane def changed my life! Hope it works just as well for you and good luck!! ",/r/SkincareAddiction/comments/8pv3gg/ba_finished_my_5_month_course_of_accutane_just_in/e0py6tb/,1529075568.0,28,t2_12fqs5,cbax297,https://www.reddit.com/user/cbax297,https://www.reddit.com/user/cbax297,1
e0ed5eq,^^^all of this.,/r/SkincareAddiction/comments/8pv3gg/ba_finished_my_5_month_course_of_accutane_just_in/e0ed5eq/,1528576092.0,400,t2_jhyyz8o,nwglassgrrl01,https://www.reddit.com/user/nwglassgrrl01,https://www.reddit.com/user/nwglassgrrl01,0
e0f1u2e,"And happy, don’t forget how much happier OP looks.

OP, good for you! ",/r/SkincareAddiction/comments/8pv3gg/ba_finished_my_5_month_course_of_accutane_just_in/e0f1u2e/,1528604883.0,38,t2_a5u7a,YippyKayYay,https://www.reddit.com/user/YippyKayYay,https://www.reddit.com/user/YippyKayYay,0
e9e44vw,I’ve honestly never been this excited for another human being before ,/r/SkincareAddiction/comments/8pv3gg/ba_finished_my_5_month_course_of_accutane_just_in/e9e44vw/,1541807879.0,5,t2_wbxu3,spacey-interruptions,https://www.reddit.com/user/spacey-interruptions,https://www.reddit.com/user/spacey-interruptions,0
e0e93uh,"For my grad makeup I’m wearing a light coverage foundation just to cover the scars, but the difference in texture of my skin in both pics is so so astounding!! I started accutane January 2nd, 2018, and just finished it on June 4th. Still got those dry lips though. 

For my routine I’ve kept it pretty simple:
 
AM
Cetaphil Gentle Skin Cleanser
Cetaphil Daily Facial Mosturizer with SPF

PM
Cetaphil Gentle Skin Cleanser
Thayers Lavender Witch Hazel
Cetaphil Daily Facial Mosturizer with SPF

Edit : Wow I just want to thank everyone for their really kind words. I really appreciate all the support and the positivity being spread around, it’s such an amazing feeling to be happy with your own skin again!! 

I’ve been having problems with acne for about 5 years now, and for anyone asking or worrying about accutane, I personally wish I’d started it sooner. Of course, I’m not an expert and you should definitely talk with a dermatologist about the drug, but in my case it was really worth it! To just be able to go to the grocery store without any makeup on and not worry about people looking at you is a feeling I haven’t had in a while. 

I’m extremely thankful that I was able to feel so confident in my dress, standing with my beautiful friends as we went to our graduation banquet last night. It was an amazing experience, and I’m just happy that high school is coming to an end! 

So again, thank you to everyone for the congratulations, I’m glad to have shared some of my experience with anyone else going through the same thing right now. ",/r/SkincareAddiction/comments/8pv3gg/ba_finished_my_5_month_course_of_accutane_just_in/e0e93uh/,1528571874.0,1255,t2_raliabz,pastabeans,https://www.reddit.com/user/pastabeans,https://www.reddit.com/user/pastabeans,14
e0e9u37,How do you like the gentle skin cleanser? You look radiant!,/r/SkincareAddiction/comments/8pv3gg/ba_finished_my_5_month_course_of_accutane_just_in/e0e9u37/,1528572626.0,228,t2_13oditnf,jenlnn,https://www.reddit.com/user/jenlnn,https://www.reddit.com/user/jenlnn,2
e0ecsry,"Thanks so much! And the cleanser works great for me, using that and the mosturizer, my skin was never ever super dry during accutane ",/r/SkincareAddiction/comments/8pv3gg/ba_finished_my_5_month_course_of_accutane_just_in/e0ecsry/,1528575720.0,173,t2_raliabz,pastabeans,https://www.reddit.com/user/pastabeans,https://www.reddit.com/user/pastabeans,1
e0ehh81,"I love that cleanser, especially when I'm using a drying acne product for an active breakout. ",/r/SkincareAddiction/comments/8pv3gg/ba_finished_my_5_month_course_of_accutane_just_in/e0ehh81/,1528580793.0,26,t2_hf692,shoomee,https://www.reddit.com/user/shoomee,https://www.reddit.com/user/shoomee,1
e0ehntt,Great to hear! I bought the trial size from Target for my 7 day cruise but was afraid to use it because I was afraid it would break me out. I've been using it for about 3 days now and I like it! It's a no-nonsense cleanser and hope to get the full size soon. Thanks again!,/r/SkincareAddiction/comments/8pv3gg/ba_finished_my_5_month_course_of_accutane_just_in/e0ehntt/,1528580996.0,13,t2_13oditnf,jenlnn,https://www.reddit.com/user/jenlnn,https://www.reddit.com/user/jenlnn,0
e0ee1wf,"try la neige's lip sleeping kit for your lips. it's $20 and you can get samples from Sephora, works better than pretty much everything else I've tried (aquaphor, vitamin e oil, various lip balms, lanolin, etc) after accutane. so happy it worked out so well for you!",/r/SkincareAddiction/comments/8pv3gg/ba_finished_my_5_month_course_of_accutane_just_in/e0ee1wf/,1528577054.0,79,,[deleted],https://www.reddit.com/user/[deleted],https://www.reddit.com/user/[deleted],1
e0emzd4,"I have this and it make the skin on my lips peel. I used it for about 4 days but my lips looked awful so I gave up. Is it one of those gets worse before it gets better things? 

Edit: Thanks for the replies. ",/r/SkincareAddiction/comments/8pv3gg/ba_finished_my_5_month_course_of_accutane_just_in/e0emzd4/,1528587039.0,17,t2_rlq8i,avocadosrgross,https://www.reddit.com/user/avocadosrgross,https://www.reddit.com/user/avocadosrgross,4
e0enb51,"Definitely not, I have it too and it’s always worked great. Maybe you’re just allergic to something in it?",/r/SkincareAddiction/comments/8pv3gg/ba_finished_my_5_month_course_of_accutane_just_in/e0enb51/,1528587412.0,26,t2_m5vf72j,wowimkatie,https://www.reddit.com/user/wowimkatie,https://www.reddit.com/user/wowimkatie,0
e0epcb1,My lips do that too. Even with simple stuff like chapstick my lips peel and look nasty as hell. I use lip scubs and those work wonders for me!,/r/SkincareAddiction/comments/8pv3gg/ba_finished_my_5_month_course_of_accutane_just_in/e0epcb1/,1528589777.0,10,t2_16017a,cocodeeznut,https://www.reddit.com/user/cocodeeznut,https://www.reddit.com/user/cocodeeznut,2
e0estoi,I think some balms like carmex have salicylic acid. Maybe it's the dead skin flaking off? Unless your lips we totally fine then just started flaking. It could totally be an allergic reaction. ,/r/SkincareAddiction/comments/8pv3gg/ba_finished_my_5_month_course_of_accutane_just_in/e0estoi/,1528593923.0,12,t2_kkiaz,miss__anthropist,https://www.reddit.com/user/miss__anthropist,https://www.reddit.com/user/miss__anthropist,0
e0evl8a,What lips scrubs do you use? DIY? Do you recommend anything? (n.b I hate honey),/r/SkincareAddiction/comments/8pv3gg/ba_finished_my_5_month_course_of_accutane_just_in/e0evl8a/,1528597130.0,3,t2_rlq8i,avocadosrgross,https://www.reddit.com/user/avocadosrgross,https://www.reddit.com/user/avocadosrgross,0
e0eqmy8,"I think it has some sort of lip plumping ingredient in it, which usually work by inducing a mild allergic reaction. for me it's virtually imperceptible, but some people are more sensitive to these reactions, and perhaps that's what you're experiencing :c I'd stop using it. also, I hope you got it from a reputable retailer, because I know places like amazon sell many knock off versions of it which don't have the same formula",/r/SkincareAddiction/comments/8pv3gg/ba_finished_my_5_month_course_of_accutane_just_in/e0eqmy8/,1528591317.0,12,,[deleted],https://www.reddit.com/user/[deleted],https://www.reddit.com/user/[deleted],1
e0f59dh,"Yep it does it to my lips too... Which sucks because it smells and feels so nice. I still haven't found my HG lip product. Tried so many things from the basic Vaseline/lanolin to $30+ lip balms, no luck yet (some things have come close, but the peeling is just not going away... I had Accutane almost twenty years ago!) ",/r/SkincareAddiction/comments/8pv3gg/ba_finished_my_5_month_course_of_accutane_just_in/e0f59dh/,1528609838.0,6,t2_yk7v6,miriena,https://www.reddit.com/user/miriena,https://www.reddit.com/user/miriena,1
e0fwg13,Have you ever tried [palmers cocoa butter swivel sticks ](http://www.walmart.com/ip/Palmers-Cocoa-Butter-Swivel-Stick-0-5oz/10311229) ? They are legit my hg lip balm. No drying bs. Just effective moisturization. ,/r/SkincareAddiction/comments/8pv3gg/ba_finished_my_5_month_course_of_accutane_just_in/e0fwg13/,1528652565.0,4,t2_bgd1n,schmisschmina,https://www.reddit.com/user/schmisschmina,https://www.reddit.com/user/schmisschmina,0
e0el2qb,It’s super simple but plain Vaseline on my lips before bed has done wonders for me.,/r/SkincareAddiction/comments/8pv3gg/ba_finished_my_5_month_course_of_accutane_just_in/e0el2qb/,1528584826.0,27,t2_12md2o,AutumnsBrains,https://www.reddit.com/user/AutumnsBrains,https://www.reddit.com/user/AutumnsBrains,1
e0eynsy,Yes! I started doing this about 2 years ago and it works so well! Vaseline even sells it in those lip squeeze tubes which makes it even easier to apply because you don't get the goop on your fingers!,/r/SkincareAddiction/comments/8pv3gg/ba_finished_my_5_month_course_of_accutane_just_in/e0eynsy/,1528600792.0,7,t2_1407zc,Gqueen716,https://www.reddit.com/user/Gqueen716,https://www.reddit.com/user/Gqueen716,1
e0ezwg1,It’s such a cheap and simple solution. I love it. ,/r/SkincareAddiction/comments/8pv3gg/ba_finished_my_5_month_course_of_accutane_just_in/e0ezwg1/,1528602351.0,5,t2_12md2o,AutumnsBrains,https://www.reddit.com/user/AutumnsBrains,https://www.reddit.com/user/AutumnsBrains,0
e0ea9kp,You look so much happier!!! ,/r/SkincareAddiction/comments/8pv3gg/ba_finished_my_5_month_course_of_accutane_just_in/e0ea9kp/,1528573069.0,40,t2_71zmg,minne_snow_ta_n_ice,https://www.reddit.com/user/minne_snow_ta_n_ice,https://www.reddit.com/user/minne_snow_ta_n_ice,0
e0evb7u,"For your lips try pure lanolin. They sell it in target as nipple balm for breastfeeding women in the femine hygiene isle, it's been life changing for me. I have naturally dry skin and I'm on tretinoin so the lanolin makes a big difference for me. 

My favorite way to use it is to apply something thin and moisturizing underneath (when I finish my face moisturizer I cut it open and let it dry out a bit and use this as it has grapeseed oil or I use the Avené lip butter) then apply the lanolin on top as a protective layer. It protects like vasaline would but better and it also moisturizes so it's amazing. I also like to use it to make my own homemade lip balms (I add marula oil, borage seed oil, and mix in some of the Nivea lip butter and even a bit of Nuxe Reve de miel). Seriously give it a try! :) Also congrats you look really lovely and I bet you feel great too! :)",/r/SkincareAddiction/comments/8pv3gg/ba_finished_my_5_month_course_of_accutane_just_in/e0evb7u/,1528596822.0,17,t2_13v8lo,throwawayacc97n5,https://www.reddit.com/user/throwawayacc97n5,https://www.reddit.com/user/throwawayacc97n5,1
e0fc9ci,"&gt; lanolin

Lanolin? La lanolin? Like sheep's wool?",/r/SkincareAddiction/comments/8pv3gg/ba_finished_my_5_month_course_of_accutane_just_in/e0fc9ci/,1528624571.0,12,t2_5safz,seopants,https://www.reddit.com/user/seopants,https://www.reddit.com/user/seopants,2
e0fctbt,Yeah it comes from sheep's wool but its treated somehow so it doesn't smell and I know it sounds a bit gross but it's commenly used it lots of skincare products since it's similar to our own oils. If it hadn't been such a Holly Grail for me I'd think it was weird or gross but it's the only thing that's worked for my super dry lips and when your lips are as dry as mine were (especially back when I was playing clarinet and saxophone) you'll do almost anything to get proper long term relief from dryness. The lanolin is thick enough that it will stay put while I'm sleeping and it's actually still there when I wake up and it's the only product that has done that for me.,/r/SkincareAddiction/comments/8pv3gg/ba_finished_my_5_month_course_of_accutane_just_in/e0fctbt/,1528625920.0,7,t2_13v8lo,throwawayacc97n5,https://www.reddit.com/user/throwawayacc97n5,https://www.reddit.com/user/throwawayacc97n5,1
e0fcwvn,"https://youtu.be/3ioqLr5341w?t=11
:)

",/r/SkincareAddiction/comments/8pv3gg/ba_finished_my_5_month_course_of_accutane_just_in/e0fcwvn/,1528626147.0,6,t2_5safz,seopants,https://www.reddit.com/user/seopants,https://www.reddit.com/user/seopants,1
e0fczh6,Haaaaa thanks that made me laugh! :):),/r/SkincareAddiction/comments/8pv3gg/ba_finished_my_5_month_course_of_accutane_just_in/e0fczh6/,1528626315.0,3,t2_13v8lo,throwawayacc97n5,https://www.reddit.com/user/throwawayacc97n5,https://www.reddit.com/user/throwawayacc97n5,1
e0fd16h,Hahaha me too,/r/SkincareAddiction/comments/8pv3gg/ba_finished_my_5_month_course_of_accutane_just_in/e0fd16h/,1528626426.0,2,t2_5safz,seopants,https://www.reddit.com/user/seopants,https://www.reddit.com/user/seopants,0
e0f3o67,"hi OP, happy graduation! You look amazing (: I just wanted to ask you if you experienced any signs of depression when you were on accutane. I don’t mean for this comment to be offensive in any way, just wanted to see how it affected you since I know that my boyfriend was affected by accutane quite strongly. thank you",/r/SkincareAddiction/comments/8pv3gg/ba_finished_my_5_month_course_of_accutane_just_in/e0f3o67/,1528607454.0,11,t2_forxr43,dpchingas,https://www.reddit.com/user/dpchingas,https://www.reddit.com/user/dpchingas,2
e0f70xt,"Oof yeah I dealt with a bit of depression, but from what I heard from other people’s stories and videos is that accutane really heightened the feelings they had before. I’d say I was feeling really down while my skin was bad, and the fatigue from the accutane didn’t help much with that. That being said, I felt worse signs of depression from a birth control I tried shortly before the accutane. When my skin started clearing up and I saw the pills were working it was such a major relief though :))",/r/SkincareAddiction/comments/8pv3gg/ba_finished_my_5_month_course_of_accutane_just_in/e0f70xt/,1528612975.0,10,t2_raliabz,pastabeans,https://www.reddit.com/user/pastabeans,https://www.reddit.com/user/pastabeans,0
e0gagp9,Why am i cryin in the club right now ,/r/SkincareAddiction/comments/8pv3gg/ba_finished_my_5_month_course_of_accutane_just_in/e0gagp9/,1528666707.0,7,t2_ddkmvzw,peechie,https://www.reddit.com/user/peechie,https://www.reddit.com/user/peechie,0
e0enav3,Congratulations!! This gives me inspiration and hope that one day my skin will be clear. ,/r/SkincareAddiction/comments/8pv3gg/ba_finished_my_5_month_course_of_accutane_just_in/e0enav3/,1528587404.0,5,t2_o1qqh,kursedsun,https://www.reddit.com/user/kursedsun,https://www.reddit.com/user/kursedsun,0
e0et2f7,"Saving this, thank you so much! I already use cetaphil but the witch hazel I have to try I've heard it works well ",/r/SkincareAddiction/comments/8pv3gg/ba_finished_my_5_month_course_of_accutane_just_in/e0et2f7/,1528594212.0,4,t2_120qeo,Kbudz,https://www.reddit.com/user/Kbudz,https://www.reddit.com/user/Kbudz,0
e0euscp,"You look so happy and radiant! For the lips I recommend Elizabeth Arden 8 Hour Cream overnight. It’s Vaseline based but there’s some other ingredients that for me, seem to make it work better than plain Vaseline.",/r/SkincareAddiction/comments/8pv3gg/ba_finished_my_5_month_course_of_accutane_just_in/e0euscp/,1528596218.0,3,t2_8wtus,BBQsauceBel,https://www.reddit.com/user/BBQsauceBel,https://www.reddit.com/user/BBQsauceBel,0
e0ef1u3,Why witch hazel after moisturizer? It’s a toner and should go before. ,/r/SkincareAddiction/comments/8pv3gg/ba_finished_my_5_month_course_of_accutane_just_in/e0ef1u3/,1528578126.0,13,t2_kqmec,xephydira,https://www.reddit.com/user/xephydira,https://www.reddit.com/user/xephydira,1
e0ef4r6,"Oh whoops I messed up on the order writing it, I do toner then moisturizer ",/r/SkincareAddiction/comments/8pv3gg/ba_finished_my_5_month_course_of_accutane_just_in/e0ef4r6/,1528578210.0,46,t2_raliabz,pastabeans,https://www.reddit.com/user/pastabeans,https://www.reddit.com/user/pastabeans,0
e0ed6a9,What moisturizer do you use? I use the Cetaphil Gentle Cleanser as well and I haven't been putting on any because i thought it already did though. Though I understand the need for it more if you're using Acutane.,/r/SkincareAddiction/comments/8pv3gg/ba_finished_my_5_month_course_of_accutane_just_in/e0ed6a9/,1528576118.0,6,,[deleted],https://www.reddit.com/user/[deleted],https://www.reddit.com/user/[deleted],1
e0ef96p,"I use the cetaphil moisturizer with spf 15, my face would get kind of squeaky feeling if I don’t put on the moisturizer right away and also the spf helps for accutane sun sensitivuty too!!",/r/SkincareAddiction/comments/8pv3gg/ba_finished_my_5_month_course_of_accutane_just_in/e0ef96p/,1528578344.0,23,t2_raliabz,pastabeans,https://www.reddit.com/user/pastabeans,https://www.reddit.com/user/pastabeans,0
e0ehowf,"Just wondering, is it necessary to wear SPF before bed? Your skin looks beautiful!",/r/SkincareAddiction/comments/8pv3gg/ba_finished_my_5_month_course_of_accutane_just_in/e0ehowf/,1528581029.0,3,t2_c5w06nc,littlelazuli,https://www.reddit.com/user/littlelazuli,https://www.reddit.com/user/littlelazuli,1
e0epkw2,No. SPF is only necessary for during the day. I wouldn't use it at night.,/r/SkincareAddiction/comments/8pv3gg/ba_finished_my_5_month_course_of_accutane_just_in/e0epkw2/,1528590056.0,16,t2_qlnom,retailbitch666,https://www.reddit.com/user/retailbitch666,https://www.reddit.com/user/retailbitch666,0
e0eabsu,"Ho....ly.....crap. You look glowing. Not just your skin which is incredible, but your smile too. Congrats on the wonderful progress! ",/r/SkincareAddiction/comments/8pv3gg/ba_finished_my_5_month_course_of_accutane_just_in/e0eabsu/,1528573135.0,461,t2_9s2n9,chewbecca108,https://www.reddit.com/user/chewbecca108,https://www.reddit.com/user/chewbecca108,0
e0e8wvf,You look beautiful! Congrats! ,/r/SkincareAddiction/comments/8pv3gg/ba_finished_my_5_month_course_of_accutane_just_in/e0e8wvf/,1528571668.0,146,t2_1eefdupv,momminaintez,https://www.reddit.com/user/momminaintez,https://www.reddit.com/user/momminaintez,0
e0eaf1g,The expression on your face says it all.  Glad that this treatment regimen worked for you.  Beautiful.,/r/SkincareAddiction/comments/8pv3gg/ba_finished_my_5_month_course_of_accutane_just_in/e0eaf1g/,1528573228.0,122,t2_l54cc,granitehoncho,https://www.reddit.com/user/granitehoncho,https://www.reddit.com/user/granitehoncho,0
e0e91dg,"You are glowing! Absolutely stunning, congratulations on your amazing transformation and on your graduation! ",/r/SkincareAddiction/comments/8pv3gg/ba_finished_my_5_month_course_of_accutane_just_in/e0e91dg/,1528571801.0,92,t2_11j3fe,Pokem0m,https://www.reddit.com/user/Pokem0m,https://www.reddit.com/user/Pokem0m,0
e0eayhz,"The smile in the ‘after’ picture says it all.  You’ve made it! You look absolutely beautiful!


You give people like me hope. Thank you, and please keep on sharing with those who think that there’s no way out. ",/r/SkincareAddiction/comments/8pv3gg/ba_finished_my_5_month_course_of_accutane_just_in/e0eayhz/,1528573794.0,71,t2_ifmgd,JuBreCaBra,https://www.reddit.com/user/JuBreCaBra,https://www.reddit.com/user/JuBreCaBra,0
e0ebb9j,"Girl I wanna see pics of that dress, the pink and silver is such a cute combo! And congrats!! 💕🌸💖",/r/SkincareAddiction/comments/8pv3gg/ba_finished_my_5_month_course_of_accutane_just_in/e0ebb9j/,1528574155.0,97,t2_19fapafq,passi0nfr00t,https://www.reddit.com/user/passi0nfr00t,https://www.reddit.com/user/passi0nfr00t,1
e0evivx,I was planning on commenting! I didn’t know if it was creepy or not but I feel like it’s super cute! ,/r/SkincareAddiction/comments/8pv3gg/ba_finished_my_5_month_course_of_accutane_just_in/e0evivx/,1528597058.0,15,t2_11pgls,K0B3ryant,https://www.reddit.com/user/K0B3ryant,https://www.reddit.com/user/K0B3ryant,0
e0ebt13,Aw you look amazing and happy! I did the Accutane treatment before my high school graduation too and it did wonders for my self-esteem.  Also I have a similar skin care routine too...I tend to stick to the basic cleansers like Cetaphil bc of how sensitive my skin is.,/r/SkincareAddiction/comments/8pv3gg/ba_finished_my_5_month_course_of_accutane_just_in/e0ebt13/,1528574669.0,33,t2_10cii7,LoneBee116,https://www.reddit.com/user/LoneBee116,https://www.reddit.com/user/LoneBee116,1
e0eebw9,"Same here, it really felt like a wonder drug if such a thing existed! The only downside was the dryness so moisturizer was important",/r/SkincareAddiction/comments/8pv3gg/ba_finished_my_5_month_course_of_accutane_just_in/e0eebw9/,1528577352.0,13,,[deleted],https://www.reddit.com/user/[deleted],https://www.reddit.com/user/[deleted],2
e0ergy3,Yeahhh I agree! I remember carrying chapstick with me everyday. Oh and don't forget the sunblock!,/r/SkincareAddiction/comments/8pv3gg/ba_finished_my_5_month_course_of_accutane_just_in/e0ergy3/,1528592312.0,4,t2_10cii7,LoneBee116,https://www.reddit.com/user/LoneBee116,https://www.reddit.com/user/LoneBee116,1
e0es30b,"The sunblock is SO important, I forgot about that!",/r/SkincareAddiction/comments/8pv3gg/ba_finished_my_5_month_course_of_accutane_just_in/e0es30b/,1528593037.0,5,,[deleted],https://www.reddit.com/user/[deleted],https://www.reddit.com/user/[deleted],0
e0f4mzu,Accutane is literally life changing. Best thing that ever happened to me. ,/r/SkincareAddiction/comments/8pv3gg/ba_finished_my_5_month_course_of_accutane_just_in/e0f4mzu/,1528608887.0,5,t2_15hmlf,Jajaninetynine,https://www.reddit.com/user/Jajaninetynine,https://www.reddit.com/user/Jajaninetynine,0
e0ea0kl,"I still remember your first post, I'm so happy for you!",/r/SkincareAddiction/comments/8pv3gg/ba_finished_my_5_month_course_of_accutane_just_in/e0ea0kl/,1528572813.0,41,t2_5gtg0,BoAKwon,https://www.reddit.com/user/BoAKwon,https://www.reddit.com/user/BoAKwon,0
e0e9pq4,Holy cow what a change. That’s awesome! Congrats on graduation as well. ,/r/SkincareAddiction/comments/8pv3gg/ba_finished_my_5_month_course_of_accutane_just_in/e0e9pq4/,1528572502.0,17,t2_jlmlq,hijackerjack,https://www.reddit.com/user/hijackerjack,https://www.reddit.com/user/hijackerjack,0
e0eam35,This is amazing!!! I’m so happy for you! You look beautiful as well :) Glad you found something that worked for you ,/r/SkincareAddiction/comments/8pv3gg/ba_finished_my_5_month_course_of_accutane_just_in/e0eam35/,1528573435.0,17,t2_gk5vkic,ffunboyz,https://www.reddit.com/user/ffunboyz,https://www.reddit.com/user/ffunboyz,0
e0eao4l,Wow pretty young lady! Congrats!,/r/SkincareAddiction/comments/8pv3gg/ba_finished_my_5_month_course_of_accutane_just_in/e0eao4l/,1528573495.0,17,t2_6135vkm,deniseyweesy,https://www.reddit.com/user/deniseyweesy,https://www.reddit.com/user/deniseyweesy,0
e0edn0t,"started my 6\-month course 2 days ago, hope I turn out like you! ",/r/SkincareAddiction/comments/8pv3gg/ba_finished_my_5_month_course_of_accutane_just_in/e0edn0t/,1528576616.0,15,t2_kgd5g,LuminalGrunt2,https://www.reddit.com/user/LuminalGrunt2,https://www.reddit.com/user/LuminalGrunt2,0
e0e9z4p,You look beautiful and congrats on graduating!!,/r/SkincareAddiction/comments/8pv3gg/ba_finished_my_5_month_course_of_accutane_just_in/e0e9z4p/,1528572771.0,14,t2_tuzfp,ohforfuckssakeintx,https://www.reddit.com/user/ohforfuckssakeintx,https://www.reddit.com/user/ohforfuckssakeintx,0
e0e9wdu,Congratulations! You're smile says it all,/r/SkincareAddiction/comments/8pv3gg/ba_finished_my_5_month_course_of_accutane_just_in/e0e9wdu/,1528572692.0,12,t2_16wmye,stewartally,https://www.reddit.com/user/stewartally,https://www.reddit.com/user/stewartally,0
e0ea1l4,Beautiful. Happy for you! Congrats on graduating too!,/r/SkincareAddiction/comments/8pv3gg/ba_finished_my_5_month_course_of_accutane_just_in/e0ea1l4/,1528572842.0,12,,[deleted],https://www.reddit.com/user/[deleted],https://www.reddit.com/user/[deleted],0
