comment_id,comment_text,comment_url,comment_time,comment_reaction_count,commenter_id,commenter_name,profile_url,commenter_url,reply_count
e0ea9od,"Holy cow - that is amazing! Congrats, both on the skin success and on graduation!",/r/SkincareAddiction/comments/8pv3gg/ba_finished_my_5_month_course_of_accutane_just_in/e0ea9od/,1528573072.0,11,,[deleted],https://www.reddit.com/user/[deleted],https://www.reddit.com/user/[deleted],0
e0eebom,Yes girl 👏🏻👏🏻👏🏻👏🏻👏🏻 you look stunning !!!!!! ,/r/SkincareAddiction/comments/8pv3gg/ba_finished_my_5_month_course_of_accutane_just_in/e0eebom/,1528577345.0,11,t2_ucl4fgf,aSunflowerPlant,https://www.reddit.com/user/aSunflowerPlant,https://www.reddit.com/user/aSunflowerPlant,0
e0ea5m4,You look amazing! ah! ,/r/SkincareAddiction/comments/8pv3gg/ba_finished_my_5_month_course_of_accutane_just_in/e0ea5m4/,1528572955.0,10,t2_69jne,canihaveteaplease,https://www.reddit.com/user/canihaveteaplease,https://www.reddit.com/user/canihaveteaplease,0
e0ea6sf,Congrats and you and your skin look beautiful! ,/r/SkincareAddiction/comments/8pv3gg/ba_finished_my_5_month_course_of_accutane_just_in/e0ea6sf/,1528572989.0,11,t2_w7zpgth,cantfindaname_,https://www.reddit.com/user/cantfindaname_,https://www.reddit.com/user/cantfindaname_,0
e0eam3j,Happy for you! You are glowing ,/r/SkincareAddiction/comments/8pv3gg/ba_finished_my_5_month_course_of_accutane_just_in/e0eam3j/,1528573435.0,10,t2_bqgrwn9,spritely77,https://www.reddit.com/user/spritely77,https://www.reddit.com/user/spritely77,0
e0eaode,"AHHH I'M SO HAPPY FOR YOU

good job OP, and congraduation!",/r/SkincareAddiction/comments/8pv3gg/ba_finished_my_5_month_course_of_accutane_just_in/e0eaode/,1528573502.0,10,t2_5eeos,bobaimee,https://www.reddit.com/user/bobaimee,https://www.reddit.com/user/bobaimee,0
e0eatmh,Complete insanity. You look amazing!!!! ,/r/SkincareAddiction/comments/8pv3gg/ba_finished_my_5_month_course_of_accutane_just_in/e0eatmh/,1528573653.0,10,t2_9c2k8,HamChad,https://www.reddit.com/user/HamChad,https://www.reddit.com/user/HamChad,0
e0eb24s,You so purdy!,/r/SkincareAddiction/comments/8pv3gg/ba_finished_my_5_month_course_of_accutane_just_in/e0eb24s/,1528573900.0,11,t2_3y8no,MetalGearFlaccid,https://www.reddit.com/user/MetalGearFlaccid,https://www.reddit.com/user/MetalGearFlaccid,0
e0eb52p,"Wow that’s amazing well done, you look amazing x",/r/SkincareAddiction/comments/8pv3gg/ba_finished_my_5_month_course_of_accutane_just_in/e0eb52p/,1528573983.0,11,t2_1dp1xjxq,lizzie123lee,https://www.reddit.com/user/lizzie123lee,https://www.reddit.com/user/lizzie123lee,0
e0ecc6u,Omgggg second hand happiness over here.. You look amazing! 😍,/r/SkincareAddiction/comments/8pv3gg/ba_finished_my_5_month_course_of_accutane_just_in/e0ecc6u/,1528575232.0,10,t2_5tvpsz1,amandajskye,https://www.reddit.com/user/amandajskye,https://www.reddit.com/user/amandajskye,0
e0ecddh,"OH MY GOD YOU’RE GLOWINGGGG 

CONGRATS ON BOTH THAT PERFECT SKIN AND ON GRADUATING!!!! ",/r/SkincareAddiction/comments/8pv3gg/ba_finished_my_5_month_course_of_accutane_just_in/e0ecddh/,1528575265.0,10,t2_wmu0rp8,mojavia,https://www.reddit.com/user/mojavia,https://www.reddit.com/user/mojavia,0
e0ecos0,Wow! Your skin is gorgeous! Such amazing results!,/r/SkincareAddiction/comments/8pv3gg/ba_finished_my_5_month_course_of_accutane_just_in/e0ecos0/,1528575602.0,10,t2_mkx82g9,Chelle422,https://www.reddit.com/user/Chelle422,https://www.reddit.com/user/Chelle422,0
e0edw9l,Congrats you look fantastic! I'm just a few days away from finishing my second round of accutane; I hope acne is gone for good for both of us! :D,/r/SkincareAddiction/comments/8pv3gg/ba_finished_my_5_month_course_of_accutane_just_in/e0edw9l/,1528576887.0,11,t2_ef6hstd,bmeislife,https://www.reddit.com/user/bmeislife,https://www.reddit.com/user/bmeislife,0
e0eedej,"Your face look absolutely amazing! As for dry lips, I can’t recommend Jouer enough. I think the only place to get it is on Nordstrom’s website, but it’s a lip conditioner with the consistency of a gloss. I sleep with it on and I wear it during the day when I need to and my lips have never been softer! I like it because it’s not at all like a lip balm. :)",/r/SkincareAddiction/comments/8pv3gg/ba_finished_my_5_month_course_of_accutane_just_in/e0eedej/,1528577398.0,10,t2_11g151,amanduhpanduh,https://www.reddit.com/user/amanduhpanduh,https://www.reddit.com/user/amanduhpanduh,0
e0ebhcc,You have a naturally beautiful face anyway but the confidence you’re showing now is amazing! Well done you! X,/r/SkincareAddiction/comments/8pv3gg/ba_finished_my_5_month_course_of_accutane_just_in/e0ebhcc/,1528574326.0,9,t2_16zjix,CharlotteBee,https://www.reddit.com/user/CharlotteBee,https://www.reddit.com/user/CharlotteBee,0
e0eegqh,"I'm so happy for you! You look glorious.
Also, I love your necklace and your dimple 😍",/r/SkincareAddiction/comments/8pv3gg/ba_finished_my_5_month_course_of_accutane_just_in/e0eegqh/,1528577499.0,8,t2_7yl1j2l,Letseatpears,https://www.reddit.com/user/Letseatpears,https://www.reddit.com/user/Letseatpears,0
e0eb5ex,Stunning! Congratulations! ,/r/SkincareAddiction/comments/8pv3gg/ba_finished_my_5_month_course_of_accutane_just_in/e0eb5ex/,1528573992.0,8,t2_y2thvl5,Brutus_87,https://www.reddit.com/user/Brutus_87,https://www.reddit.com/user/Brutus_87,0
e0ebao2,You look great! Hope you enjoy your graduation!,/r/SkincareAddiction/comments/8pv3gg/ba_finished_my_5_month_course_of_accutane_just_in/e0ebao2/,1528574138.0,7,t2_kmr3q,pinkmonkeybritt,https://www.reddit.com/user/pinkmonkeybritt,https://www.reddit.com/user/pinkmonkeybritt,0
e0ebb30,Gorgeous op! Congrats on your graduation! ,/r/SkincareAddiction/comments/8pv3gg/ba_finished_my_5_month_course_of_accutane_just_in/e0ebb30/,1528574149.0,7,t2_11ewa4,ummwell,https://www.reddit.com/user/ummwell,https://www.reddit.com/user/ummwell,0
e0ebj45,Wow! So happy for you :)!,/r/SkincareAddiction/comments/8pv3gg/ba_finished_my_5_month_course_of_accutane_just_in/e0ebj45/,1528574378.0,7,t2_rcw22,RoseMylk,https://www.reddit.com/user/RoseMylk,https://www.reddit.com/user/RoseMylk,0
e0eboi5,What a difference. You look great!,/r/SkincareAddiction/comments/8pv3gg/ba_finished_my_5_month_course_of_accutane_just_in/e0eboi5/,1528574535.0,7,t2_a2kux,Ronnie_M,https://www.reddit.com/user/Ronnie_M,https://www.reddit.com/user/Ronnie_M,0
e0ebu7z,"Wowowowowow this is incredible, I’m so happy for you!",/r/SkincareAddiction/comments/8pv3gg/ba_finished_my_5_month_course_of_accutane_just_in/e0ebu7z/,1528574705.0,7,,[deleted],https://www.reddit.com/user/[deleted],https://www.reddit.com/user/[deleted],0
e0ec45d,"Congrats and thank you for sharing your inspiring photos, your smile really shines",/r/SkincareAddiction/comments/8pv3gg/ba_finished_my_5_month_course_of_accutane_just_in/e0ec45d/,1528574994.0,6,t2_jk8cp,balmergrl,https://www.reddit.com/user/balmergrl,https://www.reddit.com/user/balmergrl,0
e0eccm3,Stunning!,/r/SkincareAddiction/comments/8pv3gg/ba_finished_my_5_month_course_of_accutane_just_in/e0eccm3/,1528575243.0,6,,[deleted],https://www.reddit.com/user/[deleted],https://www.reddit.com/user/[deleted],0
e0ed5yz,Happy graduation ❤️ you look great!,/r/SkincareAddiction/comments/8pv3gg/ba_finished_my_5_month_course_of_accutane_just_in/e0ed5yz/,1528576109.0,7,t2_ueatn,pugcorn,https://www.reddit.com/user/pugcorn,https://www.reddit.com/user/pugcorn,0
e0edaxm,"You go, sis!!!!",/r/SkincareAddiction/comments/8pv3gg/ba_finished_my_5_month_course_of_accutane_just_in/e0edaxm/,1528576254.0,6,t2_nyv82,sticky_chris,https://www.reddit.com/user/sticky_chris,https://www.reddit.com/user/sticky_chris,0
e0ee6e4,This gives me hope. I'm just about to start,/r/SkincareAddiction/comments/8pv3gg/ba_finished_my_5_month_course_of_accutane_just_in/e0ee6e4/,1528577187.0,7,,[deleted],https://www.reddit.com/user/[deleted],https://www.reddit.com/user/[deleted],0
e0eeah1,You look beautiful!!! Congrats on graduating and your skin health!!! Enjoy ☺,/r/SkincareAddiction/comments/8pv3gg/ba_finished_my_5_month_course_of_accutane_just_in/e0eeah1/,1528577310.0,6,t2_1765ml,shereikk,https://www.reddit.com/user/shereikk,https://www.reddit.com/user/shereikk,0
e0edg2i,Holy fuck. you look amazing and congratulations!!!!,/r/SkincareAddiction/comments/8pv3gg/ba_finished_my_5_month_course_of_accutane_just_in/e0edg2i/,1528576408.0,6,t2_176ess,girlwithyellowspoon,https://www.reddit.com/user/girlwithyellowspoon,https://www.reddit.com/user/girlwithyellowspoon,0
e0edp7f,"I nearly crying tears of joy for you. God, I'm so happy for you! ",/r/SkincareAddiction/comments/8pv3gg/ba_finished_my_5_month_course_of_accutane_just_in/e0edp7f/,1528576679.0,7,t2_170uce,maybehun,https://www.reddit.com/user/maybehun,https://www.reddit.com/user/maybehun,0
e0edpl1,"Stop it....



This legitimately makes me so happy!",/r/SkincareAddiction/comments/8pv3gg/ba_finished_my_5_month_course_of_accutane_just_in/e0edpl1/,1528576691.0,6,t2_16ljg6yi,WhatsUp_ItsPickles,https://www.reddit.com/user/WhatsUp_ItsPickles,https://www.reddit.com/user/WhatsUp_ItsPickles,0
e0edt9t,You look fantastic! Congrats on grad!,/r/SkincareAddiction/comments/8pv3gg/ba_finished_my_5_month_course_of_accutane_just_in/e0edt9t/,1528576799.0,6,t2_n7h77,alexandersmartalec,https://www.reddit.com/user/alexandersmartalec,https://www.reddit.com/user/alexandersmartalec,0
e0eewqx,So gorgeous! ,/r/SkincareAddiction/comments/8pv3gg/ba_finished_my_5_month_course_of_accutane_just_in/e0eewqx/,1528577977.0,4,t2_s2vwk1d,Dizzyzilla,https://www.reddit.com/user/Dizzyzilla,https://www.reddit.com/user/Dizzyzilla,0
e0efaxg,You look so beautiful go kick grauduations ass,/r/SkincareAddiction/comments/8pv3gg/ba_finished_my_5_month_course_of_accutane_just_in/e0efaxg/,1528578396.0,5,t2_11vsk8,JewtangClan91,https://www.reddit.com/user/JewtangClan91,https://www.reddit.com/user/JewtangClan91,0
e0effmc,You look beautiful and happy. Best of luck!,/r/SkincareAddiction/comments/8pv3gg/ba_finished_my_5_month_course_of_accutane_just_in/e0effmc/,1528578537.0,5,t2_cvzv1,amoodymermaid,https://www.reddit.com/user/amoodymermaid,https://www.reddit.com/user/amoodymermaid,0
e0efh6j,Everyone has said it all but I’m so very happy for you. You look beautiful. ,/r/SkincareAddiction/comments/8pv3gg/ba_finished_my_5_month_course_of_accutane_just_in/e0efh6j/,1528578585.0,6,t2_kkfvf,Brains4Beauty,https://www.reddit.com/user/Brains4Beauty,https://www.reddit.com/user/Brains4Beauty,0
e0egdcg,"Your go glen co co! You go! You look absolutely stunning! I can’t imagine how amazing you feel! Idk if I can speak for all women but being able to have a clear/clean face brings such confidence and happiness to your everyday life &lt;3

Might try your cleanse routine as well! Thanks for giving all that info! ",/r/SkincareAddiction/comments/8pv3gg/ba_finished_my_5_month_course_of_accutane_just_in/e0egdcg/,1528579561.0,5,,[deleted],https://www.reddit.com/user/[deleted],https://www.reddit.com/user/[deleted],0
e0egofq,"Maybe I’m especially emotional because my oldest graduated high school last night - but your before and after pics made me legitimately cry. 

The spark in your eyes and your smile are as big of a transformation as your skin.  You look so radiant!!!",/r/SkincareAddiction/comments/8pv3gg/ba_finished_my_5_month_course_of_accutane_just_in/e0egofq/,1528579901.0,4,t2_bos7y,fumtwee,https://www.reddit.com/user/fumtwee,https://www.reddit.com/user/fumtwee,0
e0etys1,This should be an advertisement for Accutane. You look amazing!,/r/SkincareAddiction/comments/8pv3gg/ba_finished_my_5_month_course_of_accutane_just_in/e0etys1/,1528595257.0,5,t2_134qc6,ItsRavenclawesome,https://www.reddit.com/user/ItsRavenclawesome,https://www.reddit.com/user/ItsRavenclawesome,0
e0edlsc,Ahajjsskdjxbjzzjsjxbdbhd SO BEAUTIFUL! Congrats! ,/r/SkincareAddiction/comments/8pv3gg/ba_finished_my_5_month_course_of_accutane_just_in/e0edlsc/,1528576579.0,4,t2_175x9nf,NaimahBeeema,https://www.reddit.com/user/NaimahBeeema,https://www.reddit.com/user/NaimahBeeema,0
e0ef85h,"I wish I could updated you x1000, you look beautiful! Congratulations on graduation! ",/r/SkincareAddiction/comments/8pv3gg/ba_finished_my_5_month_course_of_accutane_just_in/e0ef85h/,1528578314.0,3,t2_9nqca5k,kadev999,https://www.reddit.com/user/kadev999,https://www.reddit.com/user/kadev999,0
e0eftfq,You look great. Congratulations!!!!!,/r/SkincareAddiction/comments/8pv3gg/ba_finished_my_5_month_course_of_accutane_just_in/e0eftfq/,1528578954.0,4,,[deleted],https://www.reddit.com/user/[deleted],https://www.reddit.com/user/[deleted],0
e0eg274,I bet you feel great and are much  happier looking your best. good for you,/r/SkincareAddiction/comments/8pv3gg/ba_finished_my_5_month_course_of_accutane_just_in/e0eg274/,1528579227.0,3,t2_qpfj0uj,RedditusMus,https://www.reddit.com/user/RedditusMus,https://www.reddit.com/user/RedditusMus,0
e0egij8,"Congratulations! You look so happy, which is the best part of the before and after ",/r/SkincareAddiction/comments/8pv3gg/ba_finished_my_5_month_course_of_accutane_just_in/e0egij8/,1528579719.0,3,t2_9ub3q,severusssnape,https://www.reddit.com/user/severusssnape,https://www.reddit.com/user/severusssnape,0
e0ek79d,My god that’s life changing. 5.2k upvotes with 100% upvote rate. We are so happy for you! ,/r/SkincareAddiction/comments/8pv3gg/ba_finished_my_5_month_course_of_accutane_just_in/e0ek79d/,1528583841.0,4,t2_88wif,theSchmoopy,https://www.reddit.com/user/theSchmoopy,https://www.reddit.com/user/theSchmoopy,0
e0eouy7,"Let me tell you something. I don't care if it took some years off my life, Accutane raised my quality of life so much in the interim that I don't care. That is a wonder drug. Enjoy. ",/r/SkincareAddiction/comments/8pv3gg/ba_finished_my_5_month_course_of_accutane_just_in/e0eouy7/,1528589214.0,4,t2_95ivw,JohnBoyAndBilly,https://www.reddit.com/user/JohnBoyAndBilly,https://www.reddit.com/user/JohnBoyAndBilly,0
e0er7tu,"You look amazing, holy shit.

I had similar acne to yours when I was your age and refused to go to my grad because of it. Your skin transformation is a grown man's inspiration now. 

How did you reduce scarring? I can't believe it's all cover-up. I have bad scarring from cystic acne.",/r/SkincareAddiction/comments/8pv3gg/ba_finished_my_5_month_course_of_accutane_just_in/e0er7tu/,1528592006.0,3,t2_8flym,Lazarus_Pits,https://www.reddit.com/user/Lazarus_Pits,https://www.reddit.com/user/Lazarus_Pits,0
e0eu85s,"FYI, my cousin died of crohns disease caused from accutane. You skin looks amazing but be careful!",/r/SkincareAddiction/comments/8pv3gg/ba_finished_my_5_month_course_of_accutane_just_in/e0eu85s/,1528595573.0,4,,[deleted],https://www.reddit.com/user/[deleted],https://www.reddit.com/user/[deleted],1
e0f641c,"i’m terribly sorry that your cousin had to go through that, and even more so that you lost them. I don’t know what the precautions were for your cousin, especially depending on how long ago this was, but rest assured they’re as careful as they can be.

my brother went on accutane. he didn’t have any harsh side effects, but they still made all of the risks clear to him. if i remember correctly, he had to go in *monthly* to see his doctor, review the possible side effects and risks, and sign off to continue. accutane is one medication they’re super careful with because of the risks. it’s usually a last-resort. complications aren’t super common, it’s just that they’re much worse with this drug. it’s horrible.",/r/SkincareAddiction/comments/8pv3gg/ba_finished_my_5_month_course_of_accutane_just_in/e0f641c/,1528611317.0,5,t2_u3h7j,parmesann,https://www.reddit.com/user/parmesann,https://www.reddit.com/user/parmesann,0
e0egnlt,Congratulations! This is my dream. I am supposed to finish my course right before my university convocation. I am praying for results as good as yours!,/r/SkincareAddiction/comments/8pv3gg/ba_finished_my_5_month_course_of_accutane_just_in/e0egnlt/,1528579876.0,3,t2_owp2ya5,naya93,https://www.reddit.com/user/naya93,https://www.reddit.com/user/naya93,0
e0egvaq,"Hey, I'm also on accutane right now and this is so encouraging, you look beautiful.",/r/SkincareAddiction/comments/8pv3gg/ba_finished_my_5_month_course_of_accutane_just_in/e0egvaq/,1528580115.0,3,t2_111bmy9k,AccutaneNoobie,https://www.reddit.com/user/AccutaneNoobie,https://www.reddit.com/user/AccutaneNoobie,0
e0egztx,Wow incredible!! ,/r/SkincareAddiction/comments/8pv3gg/ba_finished_my_5_month_course_of_accutane_just_in/e0egztx/,1528580254.0,3,t2_19g4jb6j,suspiricat,https://www.reddit.com/user/suspiricat,https://www.reddit.com/user/suspiricat,0
e0eh1tk,Wow. Just wow. That us an unbelievable transformation in just 6 months. Congratulations on your graduation too. You look amazing. ,/r/SkincareAddiction/comments/8pv3gg/ba_finished_my_5_month_course_of_accutane_just_in/e0eh1tk/,1528580317.0,3,t2_x86n5,kathylcsw,https://www.reddit.com/user/kathylcsw,https://www.reddit.com/user/kathylcsw,0
e0ehvb1,"Just echoing the sentiment of this thread, but you look absolutely beautiful! I'm so happy for you!!! Congrats on graduation as well.",/r/SkincareAddiction/comments/8pv3gg/ba_finished_my_5_month_course_of_accutane_just_in/e0ehvb1/,1528581223.0,3,t2_hj8o9,tan_iel,https://www.reddit.com/user/tan_iel,https://www.reddit.com/user/tan_iel,0
e0fl355,"hard-to-find squeeze ancient spoon live fuel kiss normal wise rainstorm

 *This post was mass deleted and anonymized with [Redact](https://redact.dev/home)*",/r/SkincareAddiction/comments/8pv3gg/ba_finished_my_5_month_course_of_accutane_just_in/e0fl355/,1528640338.0,3,,[deleted],https://www.reddit.com/user/[deleted],https://www.reddit.com/user/[deleted],0
e0esltu,"This is totally why I come to this forum, for awesome and encouraging posts like this.  Congratulations on your graduation you beautiful girl!",/r/SkincareAddiction/comments/8pv3gg/ba_finished_my_5_month_course_of_accutane_just_in/e0esltu/,1528593660.0,3,t2_69r2jp2,Commodore_64k_bytes,https://www.reddit.com/user/Commodore_64k_bytes,https://www.reddit.com/user/Commodore_64k_bytes,0
e0eb4md,You look amazing! It’s incredible what a difference the right medication and routine can make. I know it’s a dangerous drug but I’m sure you feel so good about yourself now and it shows. Enjoy your graduation!,/r/SkincareAddiction/comments/8pv3gg/ba_finished_my_5_month_course_of_accutane_just_in/e0eb4md/,1528573970.0,5,,[deleted],https://www.reddit.com/user/[deleted],https://www.reddit.com/user/[deleted],1
e0eda2u,"&gt;I know it’s a dangerous drug

Is it really that dangerous though? I think they need to do updated studies because some of the ""side effects"" like suicidal tendencies had so many confounding variables (aka depression over your terrible cystic acne that's unresponsive to other treatments) I think it gives the drug a bad rap. I believe the biggest proven danger is to unborn children which is why patients need to be so careful to avoid getting pregnant (and why you can't donate blood while on Accutane).

You know what's a dangerous drug? [Tylenol](https://www.huffingtonpost.ca/entry/tylenol-overdose_n_3976991), many times over. Yet no one really seems too concerned about it which is odd.",/r/SkincareAddiction/comments/8pv3gg/ba_finished_my_5_month_course_of_accutane_just_in/e0eda2u/,1528576228.0,8,t2_3e4b1,just1nw,https://www.reddit.com/user/just1nw,https://www.reddit.com/user/just1nw,2
e0emofr,"Yeah I’m a nurse. It’s not too dangerous for males but it WILL cause birth defects and each month the patient has to see their doctor and take a pregnancy test before their prescription is refilled. And generally, accutane is used for patients when they’re most fertile lol. I’m in school for nurse practitioner and we can prescribe narcotics and benzodiazepines etc but we are supposed to refer these patients to a dermatologist for their prescription. ",/r/SkincareAddiction/comments/8pv3gg/ba_finished_my_5_month_course_of_accutane_just_in/e0emofr/,1528586693.0,3,,[deleted],https://www.reddit.com/user/[deleted],https://www.reddit.com/user/[deleted],2
e0enuec,"It’s still pretty ridiculous. I’ll prescribe methotrexate to woman in her young 30s for RA or SLE and she won’t have to fill out any forms at all or commit to two forms of birth control - meanwhile my colleagues in OB use the same drug for chemical abortions. 

Every drug has side effects. Accutane’s are significantly overblown as a result of politicking ",/r/SkincareAddiction/comments/8pv3gg/ba_finished_my_5_month_course_of_accutane_just_in/e0enuec/,1528588025.0,4,,[deleted],https://www.reddit.com/user/[deleted],https://www.reddit.com/user/[deleted],0
e0eokg8,"Yeah, the teratogenic effects are particularly bad, it's right up there with Thalidomide in terms of severity. I think that's where a lot of the reticence towards Accutane comes from, just the surprise birth defects that arose when it first came on the market. 

&gt;I’m in school for nurse practitioner and we can prescribe narcotics and benzodiazepines etc but we are supposed to refer these patients to a dermatologist for their prescription.

This is just crazy to me as opiods and benzos are objectively way, way more dangerous for patients (short and long term). It's really too bad Accutane gets such a bad rap given the kinds of dermatological results it can produce.",/r/SkincareAddiction/comments/8pv3gg/ba_finished_my_5_month_course_of_accutane_just_in/e0eokg8/,1528588870.0,3,t2_3e4b1,just1nw,https://www.reddit.com/user/just1nw,https://www.reddit.com/user/just1nw,0
e0en6iu,"I mean, I took it for 32 days and had to stop due to pancreatitis. I caught it very early on because my so grabbed me at just the right (wrong?) place. It's dangerous, so listen to your body.",/r/SkincareAddiction/comments/8pv3gg/ba_finished_my_5_month_course_of_accutane_just_in/e0en6iu/,1528587267.0,2,t2_a25n3h1,namingconventions,https://www.reddit.com/user/namingconventions,https://www.reddit.com/user/namingconventions,0
e0egf2h,"Accutane was a god send for me. It’s expensive asf but like I look so much better now and I’m so much more confident now :) glad to see it worked for you, you look so great! ",/r/SkincareAddiction/comments/8pv3gg/ba_finished_my_5_month_course_of_accutane_just_in/e0egf2h/,1528579614.0,2,,[deleted],https://www.reddit.com/user/[deleted],https://www.reddit.com/user/[deleted],0
e0egh9e,I’m so happy people aren’t giving you shit for wearing makeup like they seem to do a lot on here because this is clearly an amazing transformation. You are glowing and this is really wonderful to see!!!!,/r/SkincareAddiction/comments/8pv3gg/ba_finished_my_5_month_course_of_accutane_just_in/e0egh9e/,1528579680.0,2,,[deleted],https://www.reddit.com/user/[deleted],https://www.reddit.com/user/[deleted],0
e0eh4gm,Congrats OP!! ,/r/SkincareAddiction/comments/8pv3gg/ba_finished_my_5_month_course_of_accutane_just_in/e0eh4gm/,1528580399.0,2,t2_npapr,Tsukikage12,https://www.reddit.com/user/Tsukikage12,https://www.reddit.com/user/Tsukikage12,0
e0ehkp2,WOW!!! Okay....double congrats to you girl. 🥂😌  ,/r/SkincareAddiction/comments/8pv3gg/ba_finished_my_5_month_course_of_accutane_just_in/e0ehkp2/,1528580900.0,2,t2_u6k0lk7,cooltunesnhues,https://www.reddit.com/user/cooltunesnhues,https://www.reddit.com/user/cooltunesnhues,0
e0ehyjo,you look glowing!! congratzzzz!! i feel so happy for you \&lt;3,/r/SkincareAddiction/comments/8pv3gg/ba_finished_my_5_month_course_of_accutane_just_in/e0ehyjo/,1528581324.0,2,t2_hukqrdm,xxbxlwxx,https://www.reddit.com/user/xxbxlwxx,https://www.reddit.com/user/xxbxlwxx,0
e0ei1wg,"Wow, congrats! ",/r/SkincareAddiction/comments/8pv3gg/ba_finished_my_5_month_course_of_accutane_just_in/e0ei1wg/,1528581428.0,2,t2_2mxf8fw,ordinaryhorse,https://www.reddit.com/user/ordinaryhorse,https://www.reddit.com/user/ordinaryhorse,0
e0eien9,This is so exciting. Congratulations to you!,/r/SkincareAddiction/comments/8pv3gg/ba_finished_my_5_month_course_of_accutane_just_in/e0eien9/,1528581818.0,2,t2_fvcic,babelincoln27,https://www.reddit.com/user/babelincoln27,https://www.reddit.com/user/babelincoln27,0
e0eigyj,"Congrats! Both on the graduation and on ypur results with accutane! I am so happy for you, this is an amazing transformation. Best wishes for the future. ",/r/SkincareAddiction/comments/8pv3gg/ba_finished_my_5_month_course_of_accutane_just_in/e0eigyj/,1528581890.0,2,t2_wod2g,reneepizza,https://www.reddit.com/user/reneepizza,https://www.reddit.com/user/reneepizza,0
e0eihxa,beautiful!!!!!!!!!!!!!!!!,/r/SkincareAddiction/comments/8pv3gg/ba_finished_my_5_month_course_of_accutane_just_in/e0eihxa/,1528581918.0,2,t2_7p7wi,terferi,https://www.reddit.com/user/terferi,https://www.reddit.com/user/terferi,0
e0eitk7,Holy shit congrats!!! That’s an amazing transformation you should be really proud! Did you change anything else apart from the skincare routine and accutane? ,/r/SkincareAddiction/comments/8pv3gg/ba_finished_my_5_month_course_of_accutane_just_in/e0eitk7/,1528582276.0,2,,[deleted],https://www.reddit.com/user/[deleted],https://www.reddit.com/user/[deleted],0
e0ej2p4,Congrats! You have lovely features in both photos,/r/SkincareAddiction/comments/8pv3gg/ba_finished_my_5_month_course_of_accutane_just_in/e0ej2p4/,1528582563.0,2,t2_acjhd,Dapplegrayyousay,https://www.reddit.com/user/Dapplegrayyousay,https://www.reddit.com/user/Dapplegrayyousay,0
e0ejrpu,"Holy cow! That worked out great for you. That’s a huge difference. My brother skin troubles and I will let him know about this product. Thank you for posting. 
",/r/SkincareAddiction/comments/8pv3gg/ba_finished_my_5_month_course_of_accutane_just_in/e0ejrpu/,1528583351.0,2,t2_25pye2o,starfishdoesitmatter,https://www.reddit.com/user/starfishdoesitmatter,https://www.reddit.com/user/starfishdoesitmatter,0
