comment_id,comment_text,comment_url,comment_time,comment_reaction_count,commenter_id,commenter_name,profile_url,commenter_url,reply_count
e0ejyzt,"Yo, props. I literally had the same formation and severity of acne on my face before taking accurate. four months later I couldn’t believe I had clear skin. 

Congrats on the clear skin(you look beautiful!) and congrats on graduating! ",/r/SkincareAddiction/comments/8pv3gg/ba_finished_my_5_month_course_of_accutane_just_in/e0ejyzt/,1528583582.0,2,t2_l7bwi,dioscuri_,https://www.reddit.com/user/dioscuri_,https://www.reddit.com/user/dioscuri_,0
e0eky0f,"That looks so so painful, I'm very happy for you!  Congratulations on graduating and ur lovely skin! ",/r/SkincareAddiction/comments/8pv3gg/ba_finished_my_5_month_course_of_accutane_just_in/e0eky0f/,1528584678.0,2,,[deleted],https://www.reddit.com/user/[deleted],https://www.reddit.com/user/[deleted],0
e0em0w0,[deleted],/r/SkincareAddiction/comments/8pv3gg/ba_finished_my_5_month_course_of_accutane_just_in/e0em0w0/,1528585932.0,2,,[deleted],https://www.reddit.com/user/[deleted],https://www.reddit.com/user/[deleted],1
e0enhyx,"I’m not OP, but i am about to finish my seventh and last month on accutane, and personally the first 3 months were hell. Dry, flaky skin, nose bleeds, and my acne was worse than ever. Now, i have completely clear skin! Drink lots and lots of water (whatever you think is enough, drink more), and carry those cute little flavored vaseline tunes EVERYWHERE. that helped me get through it, and i’m so so so ecstatic about my results. I feel better than ever about myself and my skin. It’s scary and hard, the monthly visits are annoying, but I would do it all over again. ",/r/SkincareAddiction/comments/8pv3gg/ba_finished_my_5_month_course_of_accutane_just_in/e0enhyx/,1528587629.0,3,t2_15qyeu,fuhnkies,https://www.reddit.com/user/fuhnkies,https://www.reddit.com/user/fuhnkies,1
e0emcf9,You look STUNNING! ,/r/SkincareAddiction/comments/8pv3gg/ba_finished_my_5_month_course_of_accutane_just_in/e0emcf9/,1528586306.0,2,t2_14ipro,lavloves,https://www.reddit.com/user/lavloves,https://www.reddit.com/user/lavloves,0
e0enep4,"Girl I’m the exact same I graduated a few weeks ago and it was almost emotional, look at your skin and be happy ",/r/SkincareAddiction/comments/8pv3gg/ba_finished_my_5_month_course_of_accutane_just_in/e0enep4/,1528587526.0,2,t2_3rxk1hd,StayLookingSoNice,https://www.reddit.com/user/StayLookingSoNice,https://www.reddit.com/user/StayLookingSoNice,0
e0eoj1z,YOU LOOK AMAZING IM SO HAPPY FOR YOU and I love your dress it’s so perfect for your skin tone and your makeup looks bomb and congrats on graduating,/r/SkincareAddiction/comments/8pv3gg/ba_finished_my_5_month_course_of_accutane_just_in/e0eoj1z/,1528588826.0,2,t2_5plsq,pottymouthgrl,https://www.reddit.com/user/pottymouthgrl,https://www.reddit.com/user/pottymouthgrl,0
e0eoj67,What a transformation. You’re beautiful and now your skin knows too! ,/r/SkincareAddiction/comments/8pv3gg/ba_finished_my_5_month_course_of_accutane_just_in/e0eoj67/,1528588829.0,2,t2_54v7el,sugarkittypryde,https://www.reddit.com/user/sugarkittypryde,https://www.reddit.com/user/sugarkittypryde,0
e0eosmr,WOW!! I'm SO HAPPY FOR YOU I COULD CRY!!!,/r/SkincareAddiction/comments/8pv3gg/ba_finished_my_5_month_course_of_accutane_just_in/e0eosmr/,1528589135.0,2,t2_100viv,MarleySB,https://www.reddit.com/user/MarleySB,https://www.reddit.com/user/MarleySB,0
e0ep6zd,Congratulations! You look amazing! So happy for you!,/r/SkincareAddiction/comments/8pv3gg/ba_finished_my_5_month_course_of_accutane_just_in/e0ep6zd/,1528589610.0,2,t2_1552lwb0,wrks_of_jenius,https://www.reddit.com/user/wrks_of_jenius,https://www.reddit.com/user/wrks_of_jenius,0
e0epbmk,holy mother of god. what do i see...good fucking job!!!!!,/r/SkincareAddiction/comments/8pv3gg/ba_finished_my_5_month_course_of_accutane_just_in/e0epbmk/,1528589756.0,2,t2_lg1da,stambo4,https://www.reddit.com/user/stambo4,https://www.reddit.com/user/stambo4,0
e0epp1b,"I’m so happy for you, you’re killing it❤️❤️❤️",/r/SkincareAddiction/comments/8pv3gg/ba_finished_my_5_month_course_of_accutane_just_in/e0epp1b/,1528590192.0,2,t2_fjc975d,Prosstre_,https://www.reddit.com/user/Prosstre_,https://www.reddit.com/user/Prosstre_,0
e0epzyh,"Your skin looks amazing, I'm glad you got to look your best on your big day, congrats!",/r/SkincareAddiction/comments/8pv3gg/ba_finished_my_5_month_course_of_accutane_just_in/e0epzyh/,1528590549.0,2,t2_o90it,eyegore21,https://www.reddit.com/user/eyegore21,https://www.reddit.com/user/eyegore21,0
e0eq1tl,Congrats you look WONDERFUL! ,/r/SkincareAddiction/comments/8pv3gg/ba_finished_my_5_month_course_of_accutane_just_in/e0eq1tl/,1528590609.0,2,t2_67qxd,jshersher,https://www.reddit.com/user/jshersher,https://www.reddit.com/user/jshersher,0
e0eqp9p,You look great! Congrats on your graduation. What a way to end the school year!,/r/SkincareAddiction/comments/8pv3gg/ba_finished_my_5_month_course_of_accutane_just_in/e0eqp9p/,1528591391.0,2,t2_14209y,Nunyabz7,https://www.reddit.com/user/Nunyabz7,https://www.reddit.com/user/Nunyabz7,0
e0eqqoe,Wowowowowoow! ,/r/SkincareAddiction/comments/8pv3gg/ba_finished_my_5_month_course_of_accutane_just_in/e0eqqoe/,1528591437.0,2,t2_dwjgl,rninnj,https://www.reddit.com/user/rninnj,https://www.reddit.com/user/rninnj,0
e0erqkb,r/progresspics,/r/SkincareAddiction/comments/8pv3gg/ba_finished_my_5_month_course_of_accutane_just_in/e0erqkb/,1528592623.0,2,,[deleted],https://www.reddit.com/user/[deleted],https://www.reddit.com/user/[deleted],0
e0es833,You look RADIANT. Truly happy from the inside out... get that glow girl 💕🔥,/r/SkincareAddiction/comments/8pv3gg/ba_finished_my_5_month_course_of_accutane_just_in/e0es833/,1528593203.0,2,t2_jpp1dfg,rruppert01,https://www.reddit.com/user/rruppert01,https://www.reddit.com/user/rruppert01,0
e0etkhr,I felt my skin clear up just looking at this ,/r/SkincareAddiction/comments/8pv3gg/ba_finished_my_5_month_course_of_accutane_just_in/e0etkhr/,1528594785.0,2,,[deleted],https://www.reddit.com/user/[deleted],https://www.reddit.com/user/[deleted],0
e0eut8z,You look happier and more confident. I’m so happy for you. I’m sure this is a great feeling! ,/r/SkincareAddiction/comments/8pv3gg/ba_finished_my_5_month_course_of_accutane_just_in/e0eut8z/,1528596248.0,2,,[deleted],https://www.reddit.com/user/[deleted],https://www.reddit.com/user/[deleted],0
e0euuy0,Yesssss oh my god I'm so happy for you. Your skin looks so good im shook,/r/SkincareAddiction/comments/8pv3gg/ba_finished_my_5_month_course_of_accutane_just_in/e0euuy0/,1528596304.0,2,,[deleted],https://www.reddit.com/user/[deleted],https://www.reddit.com/user/[deleted],0
e0ev2jd,"Congrats, grad! ",/r/SkincareAddiction/comments/8pv3gg/ba_finished_my_5_month_course_of_accutane_just_in/e0ev2jd/,1528596548.0,2,t2_9y3wzat,feistyrooster,https://www.reddit.com/user/feistyrooster,https://www.reddit.com/user/feistyrooster,0
e0evdrg,You look so gorgeous!! Congratulations on your grad :),/r/SkincareAddiction/comments/8pv3gg/ba_finished_my_5_month_course_of_accutane_just_in/e0evdrg/,1528596901.0,2,t2_13sj72,caityinabottle,https://www.reddit.com/user/caityinabottle,https://www.reddit.com/user/caityinabottle,0
e0ew27t,You GO girl! I am so happy for you. You are glowing with confidence !!!,/r/SkincareAddiction/comments/8pv3gg/ba_finished_my_5_month_course_of_accutane_just_in/e0ew27t/,1528597682.0,2,t2_h7eaf,boohtie,https://www.reddit.com/user/boohtie,https://www.reddit.com/user/boohtie,0
e0ex9h8,"Wow! You look absolutely beautiful and amazing. Congrats, and happy graduation!",/r/SkincareAddiction/comments/8pv3gg/ba_finished_my_5_month_course_of_accutane_just_in/e0ex9h8/,1528599062.0,2,t2_nvgyk,obsessedwithmint,https://www.reddit.com/user/obsessedwithmint,https://www.reddit.com/user/obsessedwithmint,0
e0exo08,"O my GOD!!! I have no words, it looks incredible🤩 You’re strong, beautiful lady😱☺️",/r/SkincareAddiction/comments/8pv3gg/ba_finished_my_5_month_course_of_accutane_just_in/e0exo08/,1528599538.0,2,t2_zked6dr,MariMiko,https://www.reddit.com/user/MariMiko,https://www.reddit.com/user/MariMiko,0
e0f1d9m,you look beautiful in the before and after pictures 👍,/r/SkincareAddiction/comments/8pv3gg/ba_finished_my_5_month_course_of_accutane_just_in/e0f1d9m/,1528604268.0,2,t2_1b050ya3,Aaron67128,https://www.reddit.com/user/Aaron67128,https://www.reddit.com/user/Aaron67128,0
e0fru9a,You look INCREDIBLE!! Congratulations,/r/SkincareAddiction/comments/8pv3gg/ba_finished_my_5_month_course_of_accutane_just_in/e0fru9a/,1528647855.0,2,t2_2bjm2w7,spaspaspaspa,https://www.reddit.com/user/spaspaspaspa,https://www.reddit.com/user/spaspaspaspa,0
e0gj51w,"Congratulations on your graduation, and surviving your accutane treatment! It’s always varying degrees of difficult, but I remember the absolute elation I felt when I looked at my skin and for the first time had not a single blemish. It’s like being on cloud 9. Enjoy it, you deserve it!!",/r/SkincareAddiction/comments/8pv3gg/ba_finished_my_5_month_course_of_accutane_just_in/e0gj51w/,1528676011.0,2,t2_14hspw,chewiechihuahua,https://www.reddit.com/user/chewiechihuahua,https://www.reddit.com/user/chewiechihuahua,0
e1a5ydm,You look fantastic!! Brilliant how well it's worked for you.,/r/SkincareAddiction/comments/8pv3gg/ba_finished_my_5_month_course_of_accutane_just_in/e1a5ydm/,1529958553.0,2,,[deleted],https://www.reddit.com/user/[deleted],https://www.reddit.com/user/[deleted],0
e1rf03s,You’re stunning.  I feel happy for you! ,/r/SkincareAddiction/comments/8pv3gg/ba_finished_my_5_month_course_of_accutane_just_in/e1rf03s/,1530678228.0,2,,[deleted],https://www.reddit.com/user/[deleted],https://www.reddit.com/user/[deleted],0
e1tk8kz,This makes me so happy. Well done 💪,/r/SkincareAddiction/comments/8pv3gg/ba_finished_my_5_month_course_of_accutane_just_in/e1tk8kz/,1530775743.0,2,t2_10l6h3,soool93,https://www.reddit.com/user/soool93,https://www.reddit.com/user/soool93,0
e0ex8e6,"first of all congratulations, you look amazing.

i mean zero disrespect by this AT ALL. i have a genuine question. 

all of the most severe cases of cystic acne that i have seen have been on Asian people. is there perhaps something genetic that makes people of Asian descent more susceptible to cystic acne?

",/r/SkincareAddiction/comments/8pv3gg/ba_finished_my_5_month_course_of_accutane_just_in/e0ex8e6/,1528599028.0,5,,[deleted],https://www.reddit.com/user/[deleted],https://www.reddit.com/user/[deleted],0
e0egipx,YAAAAASSS BITCH!!! I LOVE IT,/r/SkincareAddiction/comments/8pv3gg/ba_finished_my_5_month_course_of_accutane_just_in/e0egipx/,1528579725.0,2,t2_x6lf6,Edbug1234,https://www.reddit.com/user/Edbug1234,https://www.reddit.com/user/Edbug1234,0
e0el4qd,"Oh, oh you poor thing. It must have been excruciating to live with that. Im so happy for you its all cleared up. I remember how psychologically stressful it was to have my face so horribly enflamed constantly with cystic acne from birth control. ",/r/SkincareAddiction/comments/8pv3gg/ba_finished_my_5_month_course_of_accutane_just_in/e0el4qd/,1528584891.0,2,t2_16617s,ashakilee,https://www.reddit.com/user/ashakilee,https://www.reddit.com/user/ashakilee,0
e0enhb9,"Holy mother fuckin shit!

God damn you beautiful bitch. That's years of difference, not just night n day.


PS- sorry for cursing. I am excited for you. ",/r/SkincareAddiction/comments/8pv3gg/ba_finished_my_5_month_course_of_accutane_just_in/e0enhb9/,1528587609.0,3,t2_12jsoy,control-_-freak,https://www.reddit.com/user/control-_-freak,https://www.reddit.com/user/control-_-freak,0
e0edifv,[removed],/r/SkincareAddiction/comments/8pv3gg/ba_finished_my_5_month_course_of_accutane_just_in/e0edifv/,1528576478.0,1,,[deleted],https://www.reddit.com/user/[deleted],https://www.reddit.com/user/[deleted],1
e0ej3jg,"Hi there,

Your comment was removed because it breaks Rule 1: Be kind and respectful.

We’d like our users to feel comfortable sharing their images without getting hit on or judged. They’re here to talk about their skin, not about their general looks or attractiveness. So complimenting OP on their skin is fine, but sexualizing comments - like saying you want to have sex with OP - are considered inappropriate in this sub. Please be mindful of that in future. 

This is an official warning; continuing to break Rule 1 will result in a ban. 

For more information, check out our [Rule Explanations](https://www.reddit.com/r/SkincareAddiction/wiki/rulesandpolicy#wiki_1._be_kind_and_respectful.).",/r/SkincareAddiction/comments/8pv3gg/ba_finished_my_5_month_course_of_accutane_just_in/e0ej3jg/,1528582589.0,7,t2_itr21,_ihavemanynames_,https://www.reddit.com/user/_ihavemanynames_,https://www.reddit.com/user/_ihavemanynames_,0
e0eismm,wow girl!congrats,/r/SkincareAddiction/comments/8pv3gg/ba_finished_my_5_month_course_of_accutane_just_in/e0eismm/,1528582247.0,1,,[deleted],https://www.reddit.com/user/[deleted],https://www.reddit.com/user/[deleted],0
e0eiwbz,Wow. Just wow ,/r/SkincareAddiction/comments/8pv3gg/ba_finished_my_5_month_course_of_accutane_just_in/e0eiwbz/,1528582362.0,1,t2_huamlsz,ARealWiggler,https://www.reddit.com/user/ARealWiggler,https://www.reddit.com/user/ARealWiggler,0
e0ejtt7,oh my goooood im so so so happy for u !!! ,/r/SkincareAddiction/comments/8pv3gg/ba_finished_my_5_month_course_of_accutane_just_in/e0ejtt7/,1528583417.0,1,t2_okxex,alicehs,https://www.reddit.com/user/alicehs,https://www.reddit.com/user/alicehs,0
e0ek0uv,Wow that's awesome. You are beautiful in both photos!,/r/SkincareAddiction/comments/8pv3gg/ba_finished_my_5_month_course_of_accutane_just_in/e0ek0uv/,1528583641.0,1,t2_xn655,cben27,https://www.reddit.com/user/cben27,https://www.reddit.com/user/cben27,0
e0ek8wy,What a difference! Congrats.,/r/SkincareAddiction/comments/8pv3gg/ba_finished_my_5_month_course_of_accutane_just_in/e0ek8wy/,1528583891.0,1,,[deleted],https://www.reddit.com/user/[deleted],https://www.reddit.com/user/[deleted],0
e0ekcan,I don't know you but I'm so happy for you. ,/r/SkincareAddiction/comments/8pv3gg/ba_finished_my_5_month_course_of_accutane_just_in/e0ekcan/,1528583998.0,1,t2_x0s39,lilyinthewater,https://www.reddit.com/user/lilyinthewater,https://www.reddit.com/user/lilyinthewater,0
e0eku7w,You look gorgeous! I am so incredibly happy for you 😊,/r/SkincareAddiction/comments/8pv3gg/ba_finished_my_5_month_course_of_accutane_just_in/e0eku7w/,1528584560.0,1,t2_pynhmd9,timber6353,https://www.reddit.com/user/timber6353,https://www.reddit.com/user/timber6353,0
e0eky2t,you're STUNNING!!! ,/r/SkincareAddiction/comments/8pv3gg/ba_finished_my_5_month_course_of_accutane_just_in/e0eky2t/,1528584680.0,1,,[deleted],https://www.reddit.com/user/[deleted],https://www.reddit.com/user/[deleted],0
e0el9tg,Oh my god wow so amazing ,/r/SkincareAddiction/comments/8pv3gg/ba_finished_my_5_month_course_of_accutane_just_in/e0el9tg/,1528585049.0,1,t2_rx74n8w,Patrikiwi,https://www.reddit.com/user/Patrikiwi,https://www.reddit.com/user/Patrikiwi,0
